{
  "batch_id": "MIG-V1-DRYRUN-001",
  "source_snapshot": "SNAP-SYNTH-001",
  "mapping_version": "1.0",
  "target_environment": "synthetic-demo",
  "status": "dry_run",
  "reconciliation": {
    "source_count": 100,
    "target_count": 100,
    "exceptions": 0
  },
  "rollback_point": "SNAP-TARGET-PRE-001"
}